{
  "$schema": "rule-catalog.schema.json",
  "schemaVersion": 1,
  "catalogedOn": "2026-09-02",
  "description": "Repository-maintenance-only provenance and lifecycle catalog for hand-authored Interactive Toolkit contract rules. Runtime contracts remain authoritative for rule wording and behavior.",
  "rules": [
    {
      "id": "REVIEW-EVID-001",
      "title": "Do not guess when evidence is required",
      "contractPath": ".github/instructions/code-review-compliance-contract.instructions.md",
      "status": "active",
      "contentSha256": "105f5efe4c75fc4b13713f0fca29e763a5d8740158a83a2fcfb16a638c76d4a1",
      "provenance": "unclassified",
      "evidence": [],
      "sourceIds": []
    },
    {
      "id": "REVIEW-EVID-002",
      "title": "Verify display artifacts before flagging formatting or encoding issues",
      "contractPath": ".github/instructions/code-review-compliance-contract.instructions.md",
      "status": "active",
      "contentSha256": "07a94398f2bfd2c1775745743e7c8ce6bdb326279bc669c9fb6b83e723e06147",
      "provenance": "unclassified",
      "evidence": [],
      "sourceIds": []
    },
    {
      "id": "REVIEW-EVID-003",
      "title": "Attribute policies to real sources",
      "contractPath": ".github/instructions/code-review-compliance-contract.instructions.md",
      "status": "active",
      "contentSha256": "3f3159837b2333bb236ab5a93ee9f10d8a300d1287edb3e6832e0b261ca09ab0",
      "provenance": "unclassified",
      "evidence": [],
      "sourceIds": []
    },
    {
      "id": "REVIEW-EVID-004",
      "title": "Discover contributor-guidance paths before claiming absence",
      "contractPath": ".github/instructions/code-review-compliance-contract.instructions.md",
      "status": "active",
      "contentSha256": "4d9f3bada8eff61300d93bca99e9840aea46a37ceee5e06852f2d84e3088175c",
      "provenance": "unclassified",
      "evidence": [],
      "sourceIds": []
    },
    {
      "id": "REVIEW-EVID-005",
      "title": "Perform post-tool verification silently",
      "contractPath": ".github/instructions/code-review-compliance-contract.instructions.md",
      "status": "active",
      "contentSha256": "41f357a3649c35fa99ebe564feb0ecb93f4eaa36f7327c3f31b3dab20dd2ec5d",
      "provenance": "unclassified",
      "evidence": [],
      "sourceIds": []
    },
    {
      "id": "REVIEW-EVID-006",
      "title": "Every invocation is a fresh audit run",
      "contractPath": ".github/instructions/code-review-compliance-contract.instructions.md",
      "status": "active",
      "contentSha256": "a757c78642a7371aaef26084030d38339e7904a6f3ab96f49ddc10dee15a37e4",
      "provenance": "unclassified",
      "evidence": [],
      "sourceIds": []
    },
    {
      "id": "REVIEW-EVID-007",
      "title": "Describe only current-run facts",
      "contractPath": ".github/instructions/code-review-compliance-contract.instructions.md",
      "status": "active",
      "contentSha256": "d8b035f8783a8f70db0dcb81d06f6536fddabddf12d9ffb6050d356044bf4100",
      "provenance": "unclassified",
      "evidence": [],
      "sourceIds": []
    },
    {
      "id": "REVIEW-EVID-008",
      "title": "Do not reuse prior review body text",
      "contractPath": ".github/instructions/code-review-compliance-contract.instructions.md",
      "status": "active",
      "contentSha256": "f2a2a8149942f5b2d87218b14b9ac78118a1236103067beed0d17ba3683024c2",
      "provenance": "unclassified",
      "evidence": [],
      "sourceIds": []
    },
    {
      "id": "REVIEW-EVID-009",
      "title": "Do not use helper scripts for trivial deterministic checks",
      "contractPath": ".github/instructions/code-review-compliance-contract.instructions.md",
      "status": "active",
      "contentSha256": "5c69fda2c1b29a2f96b1121302200ad1ab39b235412b5ae34eb22c22e8374f01",
      "provenance": "unclassified",
      "evidence": [],
      "sourceIds": []
    },
    {
      "id": "REVIEW-EVID-010",
      "title": "Do not invent prerequisite or validation scripts",
      "contractPath": ".github/instructions/code-review-compliance-contract.instructions.md",
      "status": "active",
      "contentSha256": "e4d5bad07186ad7dd00838ba21e8cfda4297ba26df66e5f98f67e063578243e0",
      "provenance": "unclassified",
      "evidence": [],
      "sourceIds": []
    },
    {
      "id": "REVIEW-CLASS-001",
      "title": "Issues are for actual problems only",
      "contractPath": ".github/instructions/code-review-compliance-contract.instructions.md",
      "status": "active",
      "contentSha256": "6718dbf13dfba09d819cb5bfce7e6ba1c49e860031e236745d8206ff39213de1",
      "provenance": "unclassified",
      "evidence": [],
      "sourceIds": []
    },
    {
      "id": "REVIEW-CLASS-001A",
      "title": "Blocking classification requires concrete current-run harm",
      "contractPath": ".github/instructions/code-review-compliance-contract.instructions.md",
      "status": "active",
      "contentSha256": "35f2eee2d0cbdb7bdc6dfac1bfe1e749c3f5e66a8f1fc2970c80a133adc33d2a",
      "provenance": "unclassified",
      "evidence": [],
      "sourceIds": []
    },
    {
      "id": "REVIEW-CLASS-001B",
      "title": "Certain variant-ownership and lifecycle defects are blocking by definition",
      "contractPath": ".github/instructions/code-review-compliance-contract.instructions.md",
      "status": "active",
      "contentSha256": "0c9eee97de45f35f0e848b554c352e875b57268abaab923c8cf3dce10ebd71cf",
      "provenance": "unclassified",
      "evidence": [],
      "sourceIds": []
    },
    {
      "id": "REVIEW-CLASS-001C",
      "title": "Concrete optional-state drift on user-managed fields is blocking by definition",
      "contractPath": ".github/instructions/code-review-compliance-contract.instructions.md",
      "status": "active",
      "contentSha256": "fcf9d01eb24288096068635f2fd4c3087d6f5ba1bd5fe4672f96e0b2257a9dc2",
      "provenance": "unclassified",
      "evidence": [],
      "sourceIds": []
    },
    {
      "id": "REVIEW-CLASS-002",
      "title": "Observations are non-blocking",
      "contractPath": ".github/instructions/code-review-compliance-contract.instructions.md",
      "status": "active",
      "contentSha256": "b84f655f6d6f5bef48a927196736fa82860eb48db214d7a3d990833fa8899d50",
      "provenance": "unclassified",
      "evidence": [],
      "sourceIds": []
    },
    {
      "id": "REVIEW-CLASS-002A",
      "title": "Evidence-backed non-blocking concerns must remain visible",
      "contractPath": ".github/instructions/code-review-compliance-contract.instructions.md",
      "status": "active",
      "contentSha256": "0d64a65b75b480384bbb0d30128588d0c0eadb11afef04f606c4fd1e43ee72fe",
      "provenance": "unclassified",
      "evidence": [],
      "sourceIds": []
    },
    {
      "id": "REVIEW-CLASS-002B",
      "title": "Update-shape and residual-state risks default to observations unless concrete harm is proven",
      "contractPath": ".github/instructions/code-review-compliance-contract.instructions.md",
      "status": "active",
      "contentSha256": "b727b701a1889d288829fadb4d531042e24d4465aac558190a1e45604f2be8ce",
      "provenance": "unclassified",
      "evidence": [],
      "sourceIds": []
    },
    {
      "id": "REVIEW-CLASS-003",
      "title": "Strengths must be factual",
      "contractPath": ".github/instructions/code-review-compliance-contract.instructions.md",
      "status": "active",
      "contentSha256": "724cd179c85f7e9d73f83663065d4d9c0fa75bdfda6bb831d13ba8bc0db5c171",
      "provenance": "unclassified",
      "evidence": [],
      "sourceIds": []
    },
    {
      "id": "REVIEW-CLASS-004",
      "title": "One finding, one classification",
      "contractPath": ".github/instructions/code-review-compliance-contract.instructions.md",
      "status": "active",
      "contentSha256": "85450ab6a0943b7d73e3c02a2dcddb16478526d1a5f15feda1e70631934e16c0",
      "provenance": "unclassified",
      "evidence": [],
      "sourceIds": []
    },
    {
      "id": "REVIEW-CLASS-005",
      "title": "Fixes must be deterministic",
      "contractPath": ".github/instructions/code-review-compliance-contract.instructions.md",
      "status": "active",
      "contentSha256": "263e5c3c4613d104fc822c362a8a236153d382900cfcf05cfeb0485ba752ea17",
      "provenance": "unclassified",
      "evidence": [],
      "sourceIds": []
    },
    {
      "id": "REVIEW-CLASS-006",
      "title": "Final moderation owner integration boundary",
      "contractPath": ".github/instructions/code-review-compliance-contract.instructions.md",
      "status": "active",
      "contentSha256": "967986d4ed6427be4f7b4ff5658513c777c706c7c605ac215d63d30a0c4f4de3",
      "provenance": "unclassified",
      "evidence": [],
      "sourceIds": []
    },
    {
      "id": "REVIEW-HANDOFF-001",
      "title": "Intermediate findings use one shared semantic shape",
      "contractPath": ".github/instructions/code-review-compliance-contract.instructions.md",
      "status": "active",
      "contentSha256": "48de377ccf5995fa0df5f3e9d5aeb321cdf8b86da17c86ec1ea83e1e5b452d12",
      "provenance": "unclassified",
      "evidence": [],
      "sourceIds": []
    },
    {
      "id": "REVIEW-HANDOFF-002",
      "title": "Classification and visibility are workflow-owned fields",
      "contractPath": ".github/instructions/code-review-compliance-contract.instructions.md",
      "status": "active",
      "contentSha256": "eb7032abeae1a8fe4e9415a775cd0de6f1692466723c7d46da6a169ac539fd9f",
      "provenance": "unclassified",
      "evidence": [],
      "sourceIds": []
    },
    {
      "id": "REVIEW-HANDOFF-003",
      "title": "Routed passes may add or refine records, but must preserve shape",
      "contractPath": ".github/instructions/code-review-compliance-contract.instructions.md",
      "status": "active",
      "contentSha256": "a6ebc959b92ab375468fcb597872520e6ff427600f2bd3ab403fdfbfa67ce7f5",
      "provenance": "unclassified",
      "evidence": [],
      "sourceIds": []